{
  "schema_version": "1",
  "source_commit": "e83d5192f321b24eb9daab843ac49a2d95d862b1",
  "source_url": "https://github.com/gluon/AbletonLive12_MIDIRemoteScripts",
  "source_files": ["Push2/custom_bank_definitions.py"],
  "license_note": "Upstream is a decompiled redistribution of Ableton's MIDI Remote Scripts. ASA does not ship any upstream source; this catalogue records only the device-class and parameter-name metadata extracted via static AST parsing, used as a Phase 2 output-validation gate.",
  "generated_at": "2026-05-28T00:00:00Z",
  "extraction_notes": "Hand-authored Saturator fixture used for JSON Schema and Live12Catalogue regression tests. Names are taken verbatim from the upstream BANK_DEFINITIONS['Saturator'] entry. type/min/max/unit/default are intentionally omitted because they are not present in static source — they live on runtime Live.DeviceParameter objects.",
  "devices": [
    {
      "class": "Saturator",
      "category": "audio_effect",
      "displayName": "Saturator",
      "parameters": [
        {"name": "Base"},
        {"name": "Color"},
        {"name": "Depth"},
        {"name": "Drive"},
        {"name": "Dry/Wet"},
        {"name": "Frequency"},
        {"name": "Output"},
        {"name": "Soft Clip"},
        {"name": "Type"},
        {"name": "WS Curve"},
        {"name": "WS Damp"},
        {"name": "WS Depth"},
        {"name": "WS Drive"},
        {"name": "WS Lin"},
        {"name": "WS Period"},
        {"name": "Width"}
      ]
    }
  ]
}
